{
  "schemaVersion": "1.1.0",
  "recordType": "chick-flicks-public-proof-receipt",
  "payload": {
    "receiptId": "cf-proof-1",
    "admissionId": "cf-admission-v1",
    "admissionPayloadSha256": "8b326e9e671b6f51c28a55f4e554c5165aeb890896ba9b502ac5eae8a011e3aa",
    "candidateId": "ep05-candidate-v1",
    "candidatePayloadSha256": "2e041db84ae0a55838f1d6e8fb84175de4c063c9cdaa2598973cc54daa63eeba",
    "observedAt": "2026-07-26T16:00:00Z",
    "verdict": "verified",
    "discovery": {"status": "verified"},
    "archive": {"status": "verified"},
    "issue": {"status": "verified"},
    "watch": null,
    "captionsAndPlayer": null,
    "returnJourney": {"status": "verified"},
    "viewportsAndAssistiveTechnology": {"status": "verified"},
    "supersedesReceiptPayloadSha256": null,
    "previousReceiptPayloadSha256": null
  },
  "integrity": {"algorithm": "sha-256", "canonicalization": "RFC8785-JCS", "payloadSha256": "38b4f04c124d5023ee1c7ac41f8027df2d10c2bf20304992bc74cdeed012deac"}
}
